Symbol,Description,Sector,Industry,Sub-Industry,asset_type,exchange_code,data_source
RTAI,COLLABORATIVE INVESTMNT SER TR RAREVIEW TAX ADVANTAGED INC,,,,ETF,UNKNOWN,THINKORSWIM
RTH,VANECK ETF TRUST RETAIL ETF,,,,ETF,UNKNOWN,THINKORSWIM
RVNU,DBX ETF TRUST XTRACK MUN INFRA ETF,,,,ETF,UNKNOWN,THINKORSWIM
RWJ,INVESCO EXCH TRADED FD TR II S&P SMALLCAP 600 ETF,,,,ETF,UNKNOWN,THINKORSWIM
RWK,INVESCO EXCH TRADED FD TR II S&P MDCP 400 REV ETF,,,,ETF,UNKNOWN,THINKORSWIM
RWL,INVESCO EXCH TRADED FD TR II S&P 500 REVENUE ETF,,,,ETF,UNKNOWN,THINKORSWIM
RWM,PROSHARES TRUST SHRT RUSSELL2000 ETF,,,,ETF,UNKNOWN,THINKORSWIM
RWO,SPDR INDEX SHARES FUNDS DJ GLB RL ES ETF,,,,ETF,UNKNOWN,THINKORSWIM
RWR,SPDR SERIES TRUST DJ REIT ETF,,,,ETF,UNKNOWN,THINKORSWIM
RWX,SPDR INDEX SHARES FUNDS DJ INTL RL ETF,,,,ETF,UNKNOWN,THINKORSWIM
RXD,PROSHARES TRUST ULTSHT HLTHCRE ETF,,,,ETF,UNKNOWN,THINKORSWIM
RXI,ISHARES TRUST GLB CNS DISC ETF,,,,ETF,UNKNOWN,THINKORSWIM
RXL,PROSHARES TRUST PSHS ULT HLTHCRE ETF,,,,ETF,UNKNOWN,THINKORSWIM
RYJ,INVESCO EXCHANGE TRADED FD TR RYMND JMS SB 1 ETF,,,,ETF,UNKNOWN,THINKORSWIM
RYLD,GLOBAL X FDS RUSSELL 2000 COVERED CALL ETF,,,,ETF,UNKNOWN,THINKORSWIM
RZG,INVESCO EXCHANGE TRADED FD TR S&P SML600 GWT ETF,,,,ETF,UNKNOWN,THINKORSWIM
RZV,INVESCO EXCHANGE TRADED FD TR S&P SML600 VAL ETF,,,,ETF,UNKNOWN,THINKORSWIM
S,SENTINELONE INC COM CL A,Information Technology,Software,Systems Software,ETF,UNKNOWN,THINKORSWIM
SAA,PROSHARES TRUST PSHS ULT SCAP600 ETF,,,,ETF,UNKNOWN,THINKORSWIM
SBB,PROSHARES TRUST SHRT SMALLCAP60 ETF,,,,ETF,UNKNOWN,THINKORSWIM
SBIO,ALPS ETF TRUST MED BREAKTHGH ETF,,,,ETF,UNKNOWN,THINKORSWIM
SCC,PROSHARES TRUST ULTRASHORT CONSUMER DISCRET,,,,ETF,UNKNOWN,THINKORSWIM
SCHA,SCHWAB STRATEGIC TR US SML CAP ETF,,,,ETF,UNKNOWN,THINKORSWIM
SCHB,SCHWAB STRATEGIC TR US BRD MKT ETF,,,,ETF,UNKNOWN,THINKORSWIM
SCHC,SCHWAB STRATEGIC TR INTL SCEQT ETF,,,,ETF,UNKNOWN,THINKORSWIM
SCHD,SCHWAB STRATEGIC TR US DIVIDEND EQ ETF,,,,ETF,UNKNOWN,THINKORSWIM
SCHE,SCHWAB STRATEGIC TR EMRG MKTEQ ETF,,,,ETF,UNKNOWN,THINKORSWIM
SCHF,SCHWAB STRATEGIC TR INTL EQTY ETF,,,,ETF,UNKNOWN,THINKORSWIM
SCHG,SCHWAB STRATEGIC TR US LCAP GR ETF,,,,ETF,UNKNOWN,THINKORSWIM
SCHH,SCHWAB STRATEGIC TR US REIT ETF,,,,ETF,UNKNOWN,THINKORSWIM
SCHI,SCHWAB STRATEGIC TR 5 10YR CORP BD ETF,,,,ETF,UNKNOWN,THINKORSWIM
SCHJ,SCHWAB STRATEGIC TR 1 5YR CORP BD ETF,,,,ETF,UNKNOWN,THINKORSWIM
SCHK,SCHWAB STRATEGIC TR 1000 INDEX ETF,,,,ETF,UNKNOWN,THINKORSWIM
SCHM,SCHWAB STRATEGIC TR US MID-CAP ETF,,,,ETF,UNKNOWN,THINKORSWIM
SCHO,SCHWAB STRATEGIC TR SHT TM US TRES ETF,,,,ETF,UNKNOWN,THINKORSWIM
SCHP,SCHWAB STRATEGIC TR US TIPS ETF,,,,ETF,UNKNOWN,THINKORSWIM
SCHQ,SCHWAB STRATEGIC TR LONG TERM US ETF,,,,ETF,UNKNOWN,THINKORSWIM
SCHR,SCHWAB STRATEGIC TR INTERMED-TERM US TREAS ETF,,,,ETF,UNKNOWN,THINKORSWIM
SCHV,SCHWAB STRATEGIC TR US LCAP VA ETF,,,,ETF,UNKNOWN,THINKORSWIM
SCHX,SCHWAB STRATEGIC TR US LRG CAP ETF,,,,ETF,UNKNOWN,THINKORSWIM
SCHZ,SCHWAB STRATEGIC TR US AGGREGATE B ETF,,,,ETF,UNKNOWN,THINKORSWIM
SCJ,ISHARES INC MSCI JAPN SMCETF,,,,ETF,UNKNOWN,THINKORSWIM
SCO,PROSHARES TRUST II ULTRASHORT BLOOMBERG CRUDE OIL,,,,ETF,UNKNOWN,THINKORSWIM
SCZ,ISHARES TRUST EAFE SML CP ETF,,,,ETF,UNKNOWN,THINKORSWIM
SDCI,USCF ETF TR SUMMERHAVEN K1 ETF,,,,ETF,UNKNOWN,THINKORSWIM
SDD,PROSHARES TRUST ULTSHT SMLCP600 ETF,,,,ETF,UNKNOWN,THINKORSWIM
SDEM,GLOBAL X FDS MSCI SUPERDVND EMRGNG MKTS,,,,ETF,UNKNOWN,THINKORSWIM
SDG,ISHARES TRUST MSCI GBL SUSTAINABLE DEVE,,,,ETF,UNKNOWN,THINKORSWIM
SDIV,GLOBAL X FDS SUPERDIVIDEND ETF,,,,ETF,UNKNOWN,THINKORSWIM
SDOG,ALPS ETF TRUST SECTR DIV DOGS ETF,,,,ETF,UNKNOWN,THINKORSWIM
SDOW,PROSHARES TRUST ULTRAPRO SHORT DOW 30 ETF,,,,ETF,UNKNOWN,THINKORSWIM
SDP,PROSHARES TRUST ULSHRT UTILS NEW ETF,,,,ETF,UNKNOWN,THINKORSWIM
SDS,PROSHARES TRUST ULTRASHRT S&P500 ETF,,,,ETF,UNKNOWN,THINKORSWIM
SDVY,FIRST TR EXCHANGE TRADED FD VI SMID RISNG ETF,,,,ETF,UNKNOWN,THINKORSWIM
SDY,SPDR SERIES TRUST S&P DIVID ETF,,,,ETF,UNKNOWN,THINKORSWIM
SECT,NORTHERN LIGHTS FUND TRUST IV MAIN SECTR ROTN ETF,,,,ETF,UNKNOWN,THINKORSWIM
SEF,PROSHARES TRUST PSHS SHTFINL ETF,,,,ETF,UNKNOWN,THINKORSWIM
SEIX,VIRTUS ETF TRUST II SEIX SR LN ETF,,,,ETF,UNKNOWN,THINKORSWIM
SEPZ,LISTED FUND TRUST TRUESHARES STRUCTURED OUTCO,,,,ETF,UNKNOWN,THINKORSWIM
SFIG,WISDOMTREE TRUST US SHT TRM CORP ETF,,,,ETF,UNKNOWN,THINKORSWIM
SFY,TIDAL ETF SOFI SELCT 500 ETF,Energy,"Oil, Gas & Consumable Fuels",Oil & Gas Exploration & Production,ETF,UNKNOWN,THINKORSWIM
SFYF,TIDAL ETF SOFI SOCIAL 50 ETF,,,,ETF,UNKNOWN,THINKORSWIM
SFYX,TIDAL ETF SOFI NEXT 500 ETF,,,,ETF,UNKNOWN,THINKORSWIM
SGDJ,SPROTT ETF TR JR GOLD MINERS E ETF,,,,ETF,UNKNOWN,THINKORSWIM
SGDM,SPROTT ETF TR GOLD MINERS ETF,,,,ETF,UNKNOWN,THINKORSWIM
SGOL,ABERDEEN STANDARD GOLD ETF TRU PHYSICAL GOLD SHARES ETF,,,,ETF,UNKNOWN,THINKORSWIM
SGOV,ISHARES TRUST ISHARES 0-3 MONTH TREASURY,,,,ETF,UNKNOWN,THINKORSWIM
SH,PROSHARES TRUST SHORT S&P 500 NE ETF,,,,ETF,UNKNOWN,THINKORSWIM
SHAG,WISDOMTREE US  EFFICIENT CORE YIELD ENHANCED ETF,,,,ETF,UNKNOWN,THINKORSWIM
SHE,SPDR MSCI USA GENDER DIVERSITY E,,,,ETF,UNKNOWN,THINKORSWIM
SHLD,GLOBAL X FDS DEFENSE TECH ETF,Consumer Discretionary,Specialty Retail,Other Specialty Retail,ETF,UNKNOWN,THINKORSWIM
SHM,SPDR SPDR NUVEEN BLOMBERG SHRT T,,,,ETF,UNKNOWN,THINKORSWIM
SHV,ISHARES TRUST SHORT TREAS BD ETF,,,,ETF,UNKNOWN,THINKORSWIM
SHY,ISHARES TRUST 1 3 YR TREAS BD ETF,,,,ETF,UNKNOWN,THINKORSWIM
SHYD,VANECK ETF TRUST VANECK SHORT HIGH YIELD MUN,,,,ETF,UNKNOWN,THINKORSWIM
SHYG,ISHARES TRUST 0-5YR HI YL CP ETF,,,,ETF,UNKNOWN,THINKORSWIM
SHYL,DBX ETF TRUST XTRACKERS SHRT ETF,,,,ETF,UNKNOWN,THINKORSWIM
SIJ,PROSHARES TRUST ULTRASHORT INDL ETF,,,,ETF,UNKNOWN,THINKORSWIM
SIL,GLOBAL X FDS GLOBAL X SILVER ETF,,,,ETF,UNKNOWN,THINKORSWIM
SILJ,ETF MANAGERS TRUST PRIME JUNIOR SILVER MINERS ETF,,,,ETF,UNKNOWN,THINKORSWIM
SIMS,SPDR S&P KENSHO INTLG ETF,,,,ETF,UNKNOWN,THINKORSWIM
SIVR,ABERDEEN STANDARD SILVER TRUST PHYSICAL SILVER SHARES ETF,,,,ETF,UNKNOWN,THINKORSWIM
SIXA,EXCHANGE TRADED CONCEPTS TRUST ETC 6 MERIDIAN MEGA CAP EQU,,,,ETF,UNKNOWN,THINKORSWIM
SIXH,EXCHANGE TRADED CONCEPTS TRUST ETC 6 MERIDIAN HEDGED EQUIT,,,,ETF,UNKNOWN,THINKORSWIM
SIXL,EXCHANGE TRADED CONCEPTS TRUST ETC 6 MERIDIAN LOW BETA EQT,,,,ETF,UNKNOWN,THINKORSWIM
SIXS,EXCHANGE TRADED CONCEPTS TRUST ETC 6 MERIDIAN SMALL CAP EQ,,,,ETF,UNKNOWN,THINKORSWIM
SIZE,ISHARES TRUST MSCI USA SIZE FACTOR ETF,,,,ETF,UNKNOWN,THINKORSWIM
SJB,PROSHARES TRUST SHRT HGH YIELD ETF,,,,ETF,UNKNOWN,THINKORSWIM
SJNK,SPDR SPDR BLOOMBERG SHORT TERM H,,,,ETF,UNKNOWN,THINKORSWIM
SKF,PROSHARES TRUST ULTSHT FINLS NEW ETF,,,,ETF,UNKNOWN,THINKORSWIM
SKOR,FLEXSHARES TRUST CR SCD US BD ETF,,,,ETF,UNKNOWN,THINKORSWIM
SKYY,FIRST TRUST EXCH TRADED FUND 2 CLOUD COMPUTING ETF,,,,ETF,UNKNOWN,THINKORSWIM
SLQD,ISHARES TRUST 0-5YR INVT GR CP ETF,,,,ETF,UNKNOWN,THINKORSWIM
SLV,ISHARES SILVER TRUST ISHARES ETF,,,,ETF,UNKNOWN,THINKORSWIM
SLVP,ISHARES INC MSCI GLB SLV&MTL ETF,,,,ETF,UNKNOWN,THINKORSWIM
SLX,VANECK ETF TRUST VANECK STEEL ETF,,,,ETF,UNKNOWN,THINKORSWIM
SLYG,SPDR SERIES TRUST S&P 600 SMCP GRW ETF,,,,ETF,UNKNOWN,THINKORSWIM
SLYV,SPDR SERIES TRUST S&P 600 SMCP VAL ETF,,,,ETF,UNKNOWN,THINKORSWIM
SMB,VANECK ETF TRUST SHORT MUNI ETF,,,,ETF,UNKNOWN,THINKORSWIM
SMCP,ETF SERIES SOLUTIONS ALPHAMARK SM ETF,,,,ETF,UNKNOWN,THINKORSWIM
SMDD,PROSHARES TRUST ULTPRO SHT ETF,,,,ETF,UNKNOWN,THINKORSWIM
SMDV,PROSHARES TRUST RUSS 2000 DIVD ETF,,,,ETF,UNKNOWN,THINKORSWIM
SMDY,SYNTAX ETF TRUST STRATIFIE MDCP ETF,,,,ETF,UNKNOWN,THINKORSWIM
SMH,VANECK ETF TRUST SEMICONDUCTOR ETF,,,,ETF,UNKNOWN,THINKORSWIM
SMIN,ISHARES TRUST MSCI INDIA SM CP ETF,,,,ETF,UNKNOWN,THINKORSWIM
SMLF,ISHARES TRUST US SMALL CAP EQUITY FACTOR,,,,ETF,UNKNOWN,THINKORSWIM
SMLV,SPDR SSGA US SMAL ETF,,,,ETF,UNKNOWN,THINKORSWIM
SMMD,ISHARES TRUST RUSEL 2500 ETF,,,,ETF,UNKNOWN,THINKORSWIM
SMMU,PIMCO ETF TRUST SHTRM MUN BD ACT ETF,,,,ETF,UNKNOWN,THINKORSWIM
SMMV,ISHARES TRUST MSCI USA SMCP MIN ETF,,,,ETF,UNKNOWN,THINKORSWIM
SMN,PROSHARES TRUST ULTRASHORT MATERIALS ETF,,,,ETF,UNKNOWN,THINKORSWIM
SMOG,VANECK ETF TRUST VANECK LOW CARBON ENERGY ETF,,,,ETF,UNKNOWN,THINKORSWIM
SNPE,DBX ETF TRUST XTRACKERS S&P ETF,,,,ETF,UNKNOWN,THINKORSWIM
SNSR,GLOBAL X FDS INTERNET OF THNG ETF,,,,ETF,UNKNOWN,THINKORSWIM
SOCL,GLOBAL X FDS SOCIAL MED ETF,,,,ETF,UNKNOWN,THINKORSWIM
SOXL,DIREXION SHARES ETF TRUST DLY SCOND 3XBU ETF,,,,ETF,UNKNOWN,THINKORSWIM
SOXS,DIREXION SHARES ETF TRUST DAILY SEMICONDUCTOR BEAR(RS,,,,ETF,UNKNOWN,THINKORSWIM
SOXX,ISHARES TRUST ISHARES SEMICONDUCTOR ETF,,,,ETF,UNKNOWN,THINKORSWIM
SOYB,TEUCRIUM COMMODITY TRUST SOYBEAN FD ETF,,,,ETF,UNKNOWN,THINKORSWIM
SPAB,SPDR SERIES TRUST PORTFOLIO AGRGTE ETF,,,,ETF,UNKNOWN,THINKORSWIM
SPBO,SPDR SERIES TRUST PORTFOLIO CRPORT ETF,,,,ETF,UNKNOWN,THINKORSWIM
SPD,SIMPLIFY EXCHANGE TRADED FDS US EQUITY PLUS DOWNSIDE ETF,,,,ETF,UNKNOWN,THINKORSWIM
SPDN,DIREXION SHARES ETF TRUST DLY S&P500 BR 1X ETF,,,,ETF,UNKNOWN,THINKORSWIM
SPDV,ETF SERIES SOLUTIONS AAM S&P 500 ETF,,,,ETF,UNKNOWN,THINKORSWIM
SPDW,SPDR INDEX SHARES FUNDS PORTFOLIO DEVLPD ETF,,,,ETF,UNKNOWN,THINKORSWIM
SPEM,SPDR INDEX SHARES FUNDS PORTFOLIO EMG MK ETF,,,,ETF,UNKNOWN,THINKORSWIM
SPEU,SPDR INDEX SHARES FUNDS PORTFLO EURP ETF,,,,ETF,UNKNOWN,THINKORSWIM
SPFF,GLOBAL X FDS GLBX SUPRINC ETF,,,,ETF,UNKNOWN,THINKORSWIM
SPGM,SPDR INDEX SHARES FUNDS PORTFLI MSCI GBL ETF,,,,ETF,UNKNOWN,THINKORSWIM
SPGP,INVESCO EXCHANGE TRADED FD TR S&P 500 GARP ETF,,,,ETF,UNKNOWN,THINKORSWIM
SPHB,INVESCO EXCH TRADED FD TR II S&P 500 HB ETF,,,,ETF,UNKNOWN,THINKORSWIM
SPHD,INVESCO EXCH TRADED FD TR II S&P500 HDL VOL ETF,,,,ETF,UNKNOWN,THINKORSWIM
SPHQ,INVESCO EXCHANGE TRADED FD TR S&P500 QUALITY ETF,,,,ETF,UNKNOWN,THINKORSWIM
SPHY,SPDR PORTFLI HIGH YLD ETF,,,,ETF,UNKNOWN,THINKORSWIM
SPIB,SPDR SERIES TRUST PORTFOLIO INTRMD ETF,,,,ETF,UNKNOWN,THINKORSWIM
SPIP,SPDR SERIES TRUST PORTFLI TIPS ETF,,,,ETF,UNKNOWN,THINKORSWIM
SPLB,SPDR SERIES TRUST PORTFOLIO LN COR ETF,,,,ETF,UNKNOWN,THINKORSWIM
SPLG,SPDR SERIES TRUST PORTFOLIO S&P 500 ETF,,,,ETF,UNKNOWN,THINKORSWIM
SPLV,INVESCO EXCH TRADED FD TR II S&P500 LOW VOL ETF,,,,ETF,UNKNOWN,THINKORSWIM
SPMB,SPDR SERIES TRUST PORTFOLIO MORTGAGE BACKED,,,,ETF,UNKNOWN,THINKORSWIM
SPMD,SPDR SERIES TRUST PORTFOLIO S&P 400 MID CAP ETF,Consumer Discretionary,Specialty Retail,Computer & Electronics Retail,ETF,UNKNOWN,THINKORSWIM
SPMO,INVESCO EXCH TRADED FD TR II S&P 500 MOMNTM ETF,,,,ETF,UNKNOWN,THINKORSWIM
SPMV,INVESCO EXCH TRADED FD TR II S&P500 MIN VAR ETF,,,,ETF,UNKNOWN,THINKORSWIM
SPPP,SPROTT PHYS PLAT & PALLAD TRST UNIT,,,,ETF,UNKNOWN,THINKORSWIM
SPSB,SPDR SERIES TRUST PORTFOLIO SHORT ETF,,,,ETF,UNKNOWN,THINKORSWIM
SPSK,TIDAL ETF SP DWJNS SUKUK ETF,,,,ETF,UNKNOWN,THINKORSWIM
SPSM,SPDR PORTFOLIO S&P 600 SM CAP ETF,,,,ETF,UNKNOWN,THINKORSWIM
SPTI,SPDR SERIES TRUST PORTFLI INTRMDIT ETF,,,,ETF,UNKNOWN,THINKORSWIM
SPTL,SPDR SERIES TRUST PORTFOLIO LN TSR ETF,,,,ETF,UNKNOWN,THINKORSWIM
SPTM,SPDR SERIES TRUST PORTFOLI S&P 1500 COMP STK ETF,,,,ETF,UNKNOWN,THINKORSWIM
SPTS,SPDR PORTFOLIO SH TSR ETF,,,,ETF,UNKNOWN,THINKORSWIM
SPUC,SIMPLIFY EXCHANGE TRADED FDS US EQUITY PLUS UPSIDE ETF,,,,ETF,UNKNOWN,THINKORSWIM
SPUS,TIDAL ETF SP FDS S&P 500 ETF,,,,ETF,UNKNOWN,THINKORSWIM
SPUU,DIREXION SHARES ETF TRUST DLY S&P500 2XS ETF,,,,ETF,UNKNOWN,THINKORSWIM
SPVM,INVESCO EXCHANGE TRADED FD TR S&P 500 VLU MOMN ETF,,,,ETF,UNKNOWN,THINKORSWIM
SPVU,INVESCO EXCH TRADED FD TR II S&P 500 ENHNCD ETF,,,,ETF,UNKNOWN,THINKORSWIM
SPXB,PROSHARES TRUST S&P 500 BD ETF,,,,ETF,UNKNOWN,THINKORSWIM
SPXE,PROSHARES TRUST SP500 EX ENRGY ETF,,,,ETF,UNKNOWN,THINKORSWIM
SPXL,DIREXION SHARES ETF TRUST DRX S&P500BULL ETF,,,,ETF,UNKNOWN,THINKORSWIM
SPXN,PROSHARES TRUST SP500 EX FINLS ETF,,,,ETF,UNKNOWN,THINKORSWIM
SPXS,DIREXION SHARES ETF TRUST DAILY S&P 500 BEAR 3X SHARES,,,,ETF,UNKNOWN,THINKORSWIM
SPXT,PROSHARES TRUST SP500 EX TECH ETF,,,,ETF,UNKNOWN,THINKORSWIM
SPXU,PROSHARES TRUST ULTRAPRO SHORT S ETF,,,,ETF,UNKNOWN,THINKORSWIM
SPXV,PROSHARES TRUST SP500 EX HLTH ETF,,,,ETF,UNKNOWN,THINKORSWIM
SPY,SPDR S&P500 ETF TRUST TR UNIT ETF,,,,ETF,UNKNOWN,THINKORSWIM
SPYC,SIMPLIFY EXCHANGE TRADED FDS US EQUITY PLUS CONVEXITY ETF,,,,ETF,UNKNOWN,THINKORSWIM
SPYD,SPDR PRTFLO S&P500 HI ETF,,,,ETF,UNKNOWN,THINKORSWIM
SPYG,SPDR SERIES TRUST PRTFLO S&P500 GW ETF,,,,ETF,UNKNOWN,THINKORSWIM
SPYV,SPDR SERIES TRUST PRTFLO S&P500 VL ETF,,,,ETF,UNKNOWN,THINKORSWIM
SPYX,SPDR SPDR S&P 500 ETF,,,,ETF,UNKNOWN,THINKORSWIM
SQEW,TWO RDS SHARED TRUST LEADERSHARES EQUITY SKEW ETF,,,,ETF,UNKNOWN,THINKORSWIM
SQLV,LEGG MASON ETF INVEST TRUST ROYCE QUANT SMALL CAP QUALI,,,,ETF,UNKNOWN,THINKORSWIM
SQQQ,PROSHARES TRUST ULTRAPRO SHORT QQQ NEW 2020,,,,ETF,UNKNOWN,THINKORSWIM
SRET,GLOBAL X FDS SUPERDIVIDEND REIT ETF,,,,ETF,UNKNOWN,THINKORSWIM
SRLN,SSGA ACTIVE ETF TR BLACKSTONE SENIOR LOAN ETF,,,,ETF,UNKNOWN,THINKORSWIM
SRS,PROSHARES TRUST ULTSHT REAL EST ETF,,,,ETF,UNKNOWN,THINKORSWIM
SRTY,PROSHARES TRUST ULTPRO SHT 2017 ETF,,,,ETF,UNKNOWN,THINKORSWIM
SRVR,PACER FDS TR DATA & INFRASTRUCTURE REAL,,,,ETF,UNKNOWN,THINKORSWIM
SSG,PROSHARES TRUST ULSHRT SEMIC NEW ETF,,,,ETF,UNKNOWN,THINKORSWIM
SSLY,SYNTAX ETF TRUST STRATIFIED SMALLCAP ETF,,,,ETF,UNKNOWN,THINKORSWIM
SSO,PROSHARES TRUST PSHS ULT S&P 500 ETF,,,,ETF,UNKNOWN,THINKORSWIM
SSPY,SYNTAX ETF TRUST STRATIFD LRG CAP ETF,,,,ETF,UNKNOWN,THINKORSWIM
SSUS,STRATEGY SHARES DAY HAGAN NED ETF,,,,ETF,UNKNOWN,THINKORSWIM
STIP,ISHARES TRUST 0-5 YR TIPS ETF,,,,ETF,UNKNOWN,THINKORSWIM
STLG,ISHARES TRUST FACTORS US GRO ETF,,,,ETF,UNKNOWN,THINKORSWIM
STOT,SSGA ACTIVE TR SPDR DBLELN SHRT ETF,,,,ETF,UNKNOWN,THINKORSWIM
STPZ,PIMCO ETF TRUST 1-5 US TIP IDX ETF,,,,ETF,UNKNOWN,THINKORSWIM
SUB,ISHARES TRUST SHRT NAT MUN ETF,,,,ETF,UNKNOWN,THINKORSWIM
SUSA,ISHARES TRUST MSCI USA ESG SLC ETF,,,,ETF,UNKNOWN,THINKORSWIM
SUSB,ISHARES TRUST ESG AWARE 1 TO 5 YEAR USD C,,,,ETF,UNKNOWN,THINKORSWIM
SUSC,ISHARES TRUST ESG AWARE USD CORPORATE BON,,,,ETF,UNKNOWN,THINKORSWIM
SUSL,ISHARES TRUST ESG MSCI LEADR ETF,,,,ETF,UNKNOWN,THINKORSWIM
SVAL,ISHARES TRUST US SMALL CAP VALUE FACTOR ETF,,,,ETF,UNKNOWN,THINKORSWIM
SVXY,PROSHARES TRUST II SHT VIX ST TRM ETF,,,,ETF,UNKNOWN,THINKORSWIM
SWAN,AMPLIFY ETF TR BLACKSWAN GRWT ETF,,,,ETF,UNKNOWN,THINKORSWIM
SYLD,CAMBRIA ETF TRUST SHSHLD YIELD ETF,,,,ETF,UNKNOWN,THINKORSWIM
SZK,PROSHARES TRUST ULTRASHORT CONSUMER STAPLES,,,,ETF,UNKNOWN,THINKORSWIM
SZNE,PACER FDS TR CFRA STVAL EQL ETF,,,,ETF,UNKNOWN,THINKORSWIM
TAGS,TEUCRIUM COMMODITY TRUST AGRICULTURE FD ETF,,,,ETF,UNKNOWN,THINKORSWIM
TAIL,CAMBRIA ETF TRUST TAIL RISK ETF,,,,ETF,UNKNOWN,THINKORSWIM
TAN,INVESCO EXCH TRADED FD TR II SOLAR ETF,,,,ETF,UNKNOWN,THINKORSWIM
TAXF,AMERICAN CENTURY INVESTMENTS DIVERSIFIED MU ETF,,,,ETF,UNKNOWN,THINKORSWIM
TBF,PROSHARES TRUST SHRT 20+YR TRE ETF,,,,ETF,UNKNOWN,THINKORSWIM
TBJL,INNOVATOR ETFS TRUST 20 PLUS YR TREAS BD 9 BUFFE,,,,ETF,UNKNOWN,THINKORSWIM
TBT,PROSHARES TRUST PSHS ULTSH 20YRS ETF,,,,ETF,UNKNOWN,THINKORSWIM
TBX,PROSHARES TRUST SHT 7-10 YR TR ETF,,,,ETF,UNKNOWN,THINKORSWIM
TCHP,T ROWE PRICE EXCHANGE-TRADED F PRICE BLUE CHIP GROWTH ETF,,,,ETF,UNKNOWN,THINKORSWIM
TDIV,FIRST TR EXCHANGE TRADED FD VI NASD TECH DIV ETF,,,,ETF,UNKNOWN,THINKORSWIM
TDSB,EXCHANGE LISTED FUNDS TRUST CABANA TARGET BETA ETF,,,,ETF,UNKNOWN,THINKORSWIM
TDSC,EXCHANGE LISTED FUNDS TRUST CABANA TARGET DRAWDOWN 10 ETF,,,,ETF,UNKNOWN,THINKORSWIM
TDTF,FLEXSHARES TRUST IBOXX 5YR TRGT ETF,,,,ETF,UNKNOWN,THINKORSWIM
TDTT,FLEXSHARES TRUST IBOXX 3R TARGT ETF,,,,ETF,UNKNOWN,THINKORSWIM
TDV,PROSHARES TRUST S&P TECH DIVIDEN ETF,,,,ETF,UNKNOWN,THINKORSWIM
TDVG,T ROWE PRICE EXCHANGE-TRADED F PRICE DIVIDEND GROWTH ETF,,,,ETF,UNKNOWN,THINKORSWIM
TECB,ISHARES TRUST US TECH BRKTHR ETF,,,,ETF,UNKNOWN,THINKORSWIM
TECL,DIREXION SHARES ETF TRUST DLY TECH BULL 3X ETF,,,,ETF,UNKNOWN,THINKORSWIM
TECS,DIREXION SHARES ETF TRUST DAILY TECHNOLOGY BEAR 3X SH,,,,ETF,UNKNOWN,THINKORSWIM
TEQI,T ROWE PRICE EXCHANGE-TRADED F PRICE EQUITY INCOME ETF,,,,ETF,UNKNOWN,THINKORSWIM
TFI,SPDR SPDR NUVEEN BLOOMBERG MUNIC,,,,ETF,UNKNOWN,THINKORSWIM
TFJL,INNOVATOR ETFS TRUST 20 PLUS YR TREAS BD 5 FLOOR,,,,ETF,UNKNOWN,THINKORSWIM
TFLO,ISHARES TRUST TRS FLT RT BD ETF,,,,ETF,UNKNOWN,THINKORSWIM
TGIF,TIDAL ETF SOFI WEEKLY INCOME ETF,,,,ETF,UNKNOWN,THINKORSWIM
TGRW,T ROWE PRICE EXCHANGE-TRADED F PRICE GROWTH STOCK ETF,,,,ETF,UNKNOWN,THINKORSWIM
THCX,INVESTMENT MANAGERS SER TR II AXS CANNABIS ETF,,,,ETF,UNKNOWN,THINKORSWIM
THD,ISHARES INC MSCI THAILND ETF,,,,ETF,UNKNOWN,THINKORSWIM
THNQ,EXCHANGE TRADED CONCEPTS TRUST ROBO GLOBAL ARTIFICIAL INTE,,,,ETF,UNKNOWN,THINKORSWIM
THY,NORTHERN LTS FD TR TOEWS AGILTY SHS DYNAM TACTICA,,,,ETF,UNKNOWN,THINKORSWIM
TILT,FLEXSHARES TRUST MORNSTAR USMKT ETF,,,,ETF,UNKNOWN,THINKORSWIM
TIP,ISHARES TRUST TIPS BD ETF,,,,ETF,UNKNOWN,THINKORSWIM
TIPX,SPDR BLOOMBERG 1 10 YEAR TIPS ETF,,,,ETF,UNKNOWN,THINKORSWIM
TIPZ,PIMCO ETF TRUST BROAD US TIPS ETF,,,,ETF,UNKNOWN,THINKORSWIM
TLH,ISHARES TRUST 10-20 YR TRS ETF,,,,ETF,UNKNOWN,THINKORSWIM
TLT,ISHARES TRUST 20 YR TR BD ETF,,,,ETF,UNKNOWN,THINKORSWIM
TLTD,FLEXSHARES TRUST M STAR DEV MKT ETF,,,,ETF,UNKNOWN,THINKORSWIM
TLTE,FLEXSHARES TRUST MSTAR EMKT FAC ETF,,,,ETF,UNKNOWN,THINKORSWIM
TMDV,PROSHARES TRUST RUSSELL US DIV ETF,,,,ETF,UNKNOWN,THINKORSWIM
TMF,DIREXION SHARES ETF TRUST DAILY 20+ YR TREAS BU (R/S),,,,ETF,UNKNOWN,THINKORSWIM
TMFC,RBB FUND INC MOTLEY FOL ETF,,,,ETF,UNKNOWN,THINKORSWIM
TMV,DIREXION SHARES ETF TRUST 20YR TRES BEAR ETF,,,,ETF,UNKNOWN,THINKORSWIM
TNA,DIREXION SHARES ETF TRUST DLY SMCAP BULL3X ETF,,,,ETF,UNKNOWN,THINKORSWIM
TOK,ISHARES TRUST MSCI KOKUSAI ETF,,,,ETF,UNKNOWN,THINKORSWIM
TOKE,CAMBRIA ETF TRUST CANNABIS ETF,,,,ETF,UNKNOWN,THINKORSWIM
TOLZ,PROSHARES TRUST DJ BRKFLD GLB ETF,,,,ETF,UNKNOWN,THINKORSWIM
TOTL,SSGA ACTIVE ETF TR SPDR TR TACTIC ETF,,,,ETF,UNKNOWN,THINKORSWIM
TPHD,TIMOTHY PLAN HIG DV STK ETF,,,,ETF,UNKNOWN,THINKORSWIM
TPIF,TIMOTHY PLAN INTL ETF,,,,ETF,UNKNOWN,THINKORSWIM
TPLC,TIMOTHY PLAN US LARGE/MID CAP CORE ETF,,,,ETF,UNKNOWN,THINKORSWIM
TPOR,DIREXION SHARES ETF TRUST DAILY TRANS 3X ETF,,,,ETF,UNKNOWN,THINKORSWIM
TPSC,TIMOTHY PLAN U S SM CP CORE ETF,,,,ETF,UNKNOWN,THINKORSWIM
TPYP,MANAGED PORTFOLIO SERIES TORTOISE NRAM PI ETF,,,,ETF,UNKNOWN,THINKORSWIM
TQQQ,PROSHARES TRUST ULTRAPRO QQQ ETF,,,,ETF,UNKNOWN,THINKORSWIM
TRND,PACER FDS TR TRENDPILOT FD ETF,,,,ETF,UNKNOWN,THINKORSWIM
TRTY,CAMBRIA ETF TRUST TRINITY ETF,,,,ETF,UNKNOWN,THINKORSWIM
TTAC,TRIMTABS ETF TR FCF US QUALITY ETF,,,,ETF,UNKNOWN,THINKORSWIM
TTAI,TRIMTABS ETF TR FCF INTERNATIONAL QUALITY ETF,,,,ETF,UNKNOWN,THINKORSWIM
TTT,PROSHARES TRUST ULSH 20YRTRE NEW ETF,,,,ETF,UNKNOWN,THINKORSWIM
TUR,ISHARES INC MSCI TURKEY ETF,,,,ETF,UNKNOWN,THINKORSWIM
TWM,PROSHARES TRUST ULTSHT RUSS2000 ETF,,,,ETF,UNKNOWN,THINKORSWIM
TYD,DIREXION SHARES ETF TRUST 7 10YR TRES BULL ETF,,,,ETF,UNKNOWN,THINKORSWIM
TYO,DIREXION SHARES ETF TRUST 7 10YR TRES BEAR ETF,,,,ETF,UNKNOWN,THINKORSWIM
TZA,DIREXION SHARES ETF TRUST DAILY SM CP BEAR ETF,,,,ETF,UNKNOWN,THINKORSWIM
UAE,ISHARES TRUST MSCI UAE ETF,,,,ETF,UNKNOWN,THINKORSWIM
UAPR,INNOVATOR ETFS TRUST INNOVATOR US EQUTY ULTRA BU,,,,ETF,UNKNOWN,THINKORSWIM
UAUG,INNOVATOR ETFS TRUST INNOVATOR US EQUTY ULTRA BU,,,,ETF,UNKNOWN,THINKORSWIM
UBOT,DIREXION SHARES ETF TRUST DIREXION DLY ROBTS AI & AUT,,,,ETF,UNKNOWN,THINKORSWIM
UBR,PROSHARES TRUST ULTRA MSCI BRAZI ETF,,,,ETF,UNKNOWN,THINKORSWIM
UBT,PROSHARES TRUST ULTRA 20YR TRE ETF,,,,ETF,UNKNOWN,THINKORSWIM
UCC,PROSHARES TRUST ULTRA CONSUMER DISCRETIONARY,,,,ETF,UNKNOWN,THINKORSWIM
UCO,PROSHARES TRUST II ULTA BLMBG 2017 ETF,,,,ETF,UNKNOWN,THINKORSWIM
UCON,FIRST TR EXCH TRADED FD VIII TCW UNCONSTRAI ETF,,,,ETF,UNKNOWN,THINKORSWIM
UDEC,INNOVATOR ETFS TRUST INNOVATOR US EQUTY ULTRA BU,,,,ETF,UNKNOWN,THINKORSWIM
UDN,INVESCO DB US DLR INDEX TR BEARISH FD ETF,,,,ETF,UNKNOWN,THINKORSWIM
UDOW,PROSHARES TRUST ULTRPRO DOW30 ETF,,,,ETF,UNKNOWN,THINKORSWIM
UEVM,VICTORY PORTFOLIOS II SHARES EMERGING MKTS VALUE,,,,ETF,UNKNOWN,THINKORSWIM
UFEB,INNOVATOR ETFS TRUST INNOVATOR US EQITY ULTRA BU,,,,ETF,UNKNOWN,THINKORSWIM
UFO,PROCURE ETF TRUST II SPACE ETF,,,,ETF,UNKNOWN,THINKORSWIM
UGA,UNITED STATES GASOLINE FUND LP UNITS ETF,,,,ETF,UNKNOWN,THINKORSWIM
UGE,PROSHARES TRUST ULTRA CONSUMER STAPLES ETF,,,,ETF,UNKNOWN,THINKORSWIM
UGL,PROSHARES TRUST II ULTRA GOLD ETF,,,,ETF,UNKNOWN,THINKORSWIM
UITB,VICTORY PORTFOLIOS II CORE INTERMEDIATE BOND ETF,,,,ETF,UNKNOWN,THINKORSWIM
UIVM,VICTORY PORTFOLIOS II SHARES INTL VAL MOMENTUM ET,,,,ETF,UNKNOWN,THINKORSWIM
UJAN,INNOVATOR ETFS TRUST INNOVATOR US EQUTY ULTRA,,,,ETF,UNKNOWN,THINKORSWIM
UJB,PROSHARES TRUST ULTRA HIGH YLD ETF,,,,ETF,UNKNOWN,THINKORSWIM
UJUL,INNOVATOR ETFS TRUST INNOVATOR US EQIY ULTRA,,,,ETF,UNKNOWN,THINKORSWIM
UJUN,INNOVATOR ETFS TRUST INNOVATOR US EQUTY ULTRA BU,,,,ETF,UNKNOWN,THINKORSWIM
ULE,PROSHARES TRUST II PSH ULTRA EURO ETF,,,,ETF,UNKNOWN,THINKORSWIM
ULST,SSGA ACTIVE ETF TR ULT SHT TRM BD ETF,,,,ETF,UNKNOWN,THINKORSWIM
ULTR,INDEXIQ ACTIVE ETF IQ ULTR SHT DU ETF,Industrials,Air Freight & Logistics,Air Freight & Logistics,ETF,UNKNOWN,THINKORSWIM
ULVM,VICTORY PORTFOLIOS II HARES US VALUE MOMENTUM ETF,,,,ETF,UNKNOWN,THINKORSWIM
UMAR,INNOVATOR ETFS TRUST INNOVATOR US EQUTY ULTRA BU,,,,ETF,UNKNOWN,THINKORSWIM
UMAY,INNOVATOR ETFS TRUST INNOVATOR US EQUTY ULTRA BU,,,,ETF,UNKNOWN,THINKORSWIM
UMDD,PROSHARES TRUST ULTRA MDCAP400 ETF,,,,ETF,UNKNOWN,THINKORSWIM
UNG,UNITED STATES NATURAL GAS FUND UNIT PAR ETF,,,,ETF,UNKNOWN,THINKORSWIM
UNL,UNITED STS 12 MONTH NAT GAS FD UNIT BEN INT ETF,,,,ETF,UNKNOWN,THINKORSWIM
UNOV,INNOVATOR ETFS TRUST INNOVATOR US EQUTY ULTRA BU,,,,ETF,UNKNOWN,THINKORSWIM
UOCT,INNOVATOR ETFS TRUST INNOVATOR US EQUTY ULTRA BU,,,,ETF,UNKNOWN,THINKORSWIM
UPRO,PROSHARES TRUST ULTRPRO S&P500 ETF,,,,ETF,UNKNOWN,THINKORSWIM
UPV,PROSHARES TRUST ULT FTSE EUROPE ETF,,,,ETF,UNKNOWN,THINKORSWIM
UPW,PROSHARES TRUST PSHS ULTRA UTIL ETF,,,,ETF,UNKNOWN,THINKORSWIM
URA,GLOBAL X FDS GLOBAL X URANIUM ETF,,,,ETF,UNKNOWN,THINKORSWIM
URE,PROSHARES TRUST ULT R/EST NEW ETF,,,,ETF,UNKNOWN,THINKORSWIM
URNM,SPROTT FDS TR URANIUM MINERS ETF,,,,ETF,UNKNOWN,THINKORSWIM
URTH,ISHARES INC MSCI WORLD ETF,,,,ETF,UNKNOWN,THINKORSWIM
URTY,PROSHARES TRUST ULTR RUSSL2000 ETF,,,,ETF,UNKNOWN,THINKORSWIM
USAI,PACER FDS TR AMERCN ENRGY IND ETF,,,,ETF,UNKNOWN,THINKORSWIM
USCI,UNITED STS COMMODITY INDEX FD COMM IDX FND ETF,,,,ETF,UNKNOWN,THINKORSWIM
USD,PROSHARES TRUST PSHS ULT SEMICDT ETF,,,,ETF,UNKNOWN,THINKORSWIM
USDU,WISDOMTREE TRUST BLMBG US BULL ETF,,,,ETF,UNKNOWN,THINKORSWIM
USEP,INNOVATOR ETFS TRUST US EQUITY ULTRA BUF ETF SEPT,,,,ETF,UNKNOWN,THINKORSWIM
USFR,WISDOMTREE US  EFFICIENT CORE FLOATING RATE TREASURY FUND,,,,ETF,UNKNOWN,THINKORSWIM
USHY,ISHARES TRUST BROAD USD HIGH ETF,,,,ETF,UNKNOWN,THINKORSWIM
USIG,ISHARES TRUST BROAD USD INVT GRD CORP BD ETF,,,,ETF,UNKNOWN,THINKORSWIM
USL,UNITED STS 12 MONTH OIL FD LP UNIT BEN INT ETF,,,,ETF,UNKNOWN,THINKORSWIM
USMC,PRINCIPAL EXCHANGE-TRADED FDS PRINCIPAL U.S. MEGA-CAP ETF,,,,ETF,UNKNOWN,THINKORSWIM
USMF,WISDOMTREE US  EFFICIENT CORE US MULTIFACTOR ETF,,,,ETF,UNKNOWN,THINKORSWIM
USMV,ISHARES TRUST MSCI USA MIN VOL FACTOR ETF,,,,ETF,UNKNOWN,THINKORSWIM
USO,UNITED STATES OIL FUND LP UNITS ETF,,,,ETF,UNKNOWN,THINKORSWIM
USRT,ISHARES TRUST CRE U S REIT ETF,,,,ETF,UNKNOWN,THINKORSWIM
USSG,DBX ETF TRUST XTRCKR MSCI US ETF,,,,ETF,UNKNOWN,THINKORSWIM
UST,PROSHARES TRUST ULTR 7-10 TREA ETF,,,,ETF,UNKNOWN,THINKORSWIM
USTB,VICTORY PORTFOLIOS II SHORT-TERM BOND ETF,,,,ETF,UNKNOWN,THINKORSWIM
USVM,VICTORY PORTFOLIOS II SHARES USAA MSCI USA SMALL,,,,ETF,UNKNOWN,THINKORSWIM
USXF,ISHARES TRUST ESG ADVANCED MSCI USA ETF,,,,ETF,UNKNOWN,THINKORSWIM
UTES,ETFIS SER TR I VIRTUS REAVES UTILITIES ETF,,,,ETF,UNKNOWN,THINKORSWIM
UTRN,EXCHANGE TRADED CONCEPTS TRUST VSPR US LC ETF,,,,ETF,UNKNOWN,THINKORSWIM
UTSL,DIREXION SHARES ETF TRUST DLY UTLTIES 3X ETF,,,,ETF,UNKNOWN,THINKORSWIM
UUP,INVESCO DB US DLR INDEX TR BULLISH FD ETF,,,,ETF,UNKNOWN,THINKORSWIM
UVXY,PROSHARES TRUST II ULTRA VIX SHORT TERM FUTURE,,,,ETF,UNKNOWN,THINKORSWIM
UWM,PROSHARES TRUST PSHS ULTRUSS2000 ETF,,,,ETF,UNKNOWN,THINKORSWIM
UXI,PROSHARES TRUST PSHS ULTRA INDL ETF,,,,ETF,UNKNOWN,THINKORSWIM
UYG,PROSHARES TRUST ULTRA FNCLS NEW ETF,,,,ETF,UNKNOWN,THINKORSWIM
UYM,PROSHARES TRUST ULTRA MATERIALS ETF,,,,ETF,UNKNOWN,THINKORSWIM
VALQ,AMERICAN CENTURY INVESTMENTS US QUALITY VALUE ETF,,,,ETF,UNKNOWN,THINKORSWIM
VAMO,CAMBRIA ETF TRUST VALUE MOMENTUM ETF,,,,ETF,UNKNOWN,THINKORSWIM
VAW,VANGUARD MATERIALS ETF,,,,ETF,UNKNOWN,THINKORSWIM
VB,VANGUARD SMALL CP ETF,,,,ETF,UNKNOWN,THINKORSWIM
VBK,VANGUARD SML CP GRW ETF,,,,ETF,UNKNOWN,THINKORSWIM
VBND,ETF SERIES SOLUTIONS VIDENT U.S. BOND STRATEGY ETF,,,,ETF,UNKNOWN,THINKORSWIM
VBR,VANGUARD SM CP VAL ETF,,,,ETF,UNKNOWN,THINKORSWIM
VCEB,VANGUARD ESG U.S. CORPORATE BOND ETF,,,,ETF,UNKNOWN,THINKORSWIM
VCIT,VANGUARD INT-TERM CORP ETF,,,,ETF,UNKNOWN,THINKORSWIM
VCLT,VANGUARD LG-TERM COR BD ETF,,,,ETF,UNKNOWN,THINKORSWIM
VCR,VANGUARD CONSUM DIS ETF,,,,ETF,UNKNOWN,THINKORSWIM
VCSH,VANGUARD SHRT TRM CORP BD ETF,,,,ETF,UNKNOWN,THINKORSWIM
VDC,VANGUARD CONSUM STP ETF,,,,ETF,UNKNOWN,THINKORSWIM
VDE,VANGUARD ENERGY ETF,,,,ETF,UNKNOWN,THINKORSWIM
VEA,VANGUARD FTSE DEVELOPED MKTS ETF,,,,ETF,UNKNOWN,THINKORSWIM
VEGA,ADVISORSHARES TRUST STAR GLOB BUYW ETF,,,,ETF,UNKNOWN,THINKORSWIM
VEGI,ISHARES INC MSCI AGRICULTURE PRODUCERS ETF,,,,ETF,UNKNOWN,THINKORSWIM
VEGN,ETF SERIES SOLUTIONS US VEGAN CLIMATE ETF,,,,ETF,UNKNOWN,THINKORSWIM
VEU,VANGUARD ALLWRLD EX US ETF,,,,ETF,UNKNOWN,THINKORSWIM
VFH,VANGUARD FINANCIALS ETF,,,,ETF,UNKNOWN,THINKORSWIM
VFMF,VANGUARD US MULTIFACTOR ETF,,,,ETF,UNKNOWN,THINKORSWIM
VFMO,VANGUARD US MOMENTUM ETF,,,,ETF,UNKNOWN,THINKORSWIM
VFMV,VANGUARD US MINIMUM ETF,,,,ETF,UNKNOWN,THINKORSWIM
VFQY,VANGUARD US QUALITY ETF,,,,ETF,UNKNOWN,THINKORSWIM
VFVA,VANGUARD US VALUE FACTR ETF,,,,ETF,UNKNOWN,THINKORSWIM
VGIT,VANGUARD INTER TERM TREAS ETF,,,,ETF,UNKNOWN,THINKORSWIM
VGK,VANGUARD FTSE EUROPE ETF,,,,ETF,UNKNOWN,THINKORSWIM
VGLT,VANGUARD LONG-TERM TREASURY ETF,,,,ETF,UNKNOWN,THINKORSWIM
VGSH,VANGUARD SHORT TERM TREAS ETF,,,,ETF,UNKNOWN,THINKORSWIM
VGT,VANGUARD INF TECH ETF,,,,ETF,UNKNOWN,THINKORSWIM
VHT,VANGUARD HEALTH CAR ETF,,,,ETF,UNKNOWN,THINKORSWIM
