Symbol,Description,Sector,Industry,Sub-Industry,asset_type,exchange_code,data_source
GEM,GOLDMAN SACHS ETF TRUST ACTIVEBETA EME ETF,,,,ETF,UNKNOWN,THINKORSWIM
GERM,ETF MANAGERS TRUST ETFMG TRATMNTS TSTNG AND AD,,,,ETF,UNKNOWN,THINKORSWIM
GHYB,GOLDMAN SACHS ETF TRUST ACCESS HIG YLD ETF,,,,ETF,UNKNOWN,THINKORSWIM
GHYG,ISHARES INC US INTL HGH YLD ETF,,,,ETF,UNKNOWN,THINKORSWIM
GIGB,GOLDMAN SACHS ETF TRUST ACCESS INVT GR ETF,,,,ETF,UNKNOWN,THINKORSWIM
GII,SPDR INDEX SHARES FUNDS S&P GBLINF ETF,,,,ETF,UNKNOWN,THINKORSWIM
GINN,GOLDMAN SACHS ETF TRUST INNOVATE EQUITY ETF COM SHS,,,,ETF,UNKNOWN,THINKORSWIM
GLD,SPDR GOLD TRUST GOLD SHS ETF,,,,ETF,UNKNOWN,THINKORSWIM
GLDM,WORLD GOLD TRUST SPDR GLD MINIS ETF,,,,ETF,UNKNOWN,THINKORSWIM
GLIF,AGF INVESTMENTS TR AGF GLOBAL INFRASTRUCTR ETF,,,,ETF,UNKNOWN,THINKORSWIM
GLIN,VANECK ETF TRUST VANECK INDIA GROWTH LEADERS,,,,ETF,UNKNOWN,THINKORSWIM
GLL,PROSHARES TRUST II ULTRASHRT NEW ETF,,,,ETF,UNKNOWN,THINKORSWIM
GLTR,ABERDEEN PREIOUS MTLS BSKT TR ABRDN PRECIOUS METALS BASKE,,,,ETF,UNKNOWN,THINKORSWIM
GMF,SPDR INDEX SHARES FUNDS ASIA PACIF ETF,,,,ETF,UNKNOWN,THINKORSWIM
GMOM,CAMBRIA ETF TRUST GLB MOMENT ETF,,,,ETF,UNKNOWN,THINKORSWIM
GNMA,ISHARES TRUST GNMA BOND ETF,,,,ETF,UNKNOWN,THINKORSWIM
GNOM,GLOBAL X FDS GENOMIC BIOTECH ETF,,,,ETF,UNKNOWN,THINKORSWIM
GNR,SPDR INDEX SHARES FUNDS GLB NAT RESRCE ETF,,,,ETF,UNKNOWN,THINKORSWIM
GOAU,ETF SERIES SOLUTIONS US GBL GLD PRE ETF,,,,ETF,UNKNOWN,THINKORSWIM
GOEX,GLOBAL X FDS GLOBAL X GOLD EX ETF,,,,ETF,UNKNOWN,THINKORSWIM
GOVT,ISHARES TRUST US TREAS BD ETF,,,,ETF,UNKNOWN,THINKORSWIM
GOVZ,ISHARES TRUST ISHARES 25+ YR TREASURY STR,,,,ETF,UNKNOWN,THINKORSWIM
GQRE,FLEXSHARES TRUST GLB QLT R/E IDX ETF,,,,ETF,UNKNOWN,THINKORSWIM
GREK,GLOBAL X FDS MSCI GREECE ETF,,,,ETF,UNKNOWN,THINKORSWIM
GRID,FIRST TRUST EXCH TRADED FUND 2 NASDQ CLN EDGE ETF,,,,ETF,UNKNOWN,THINKORSWIM
GRNB,VANECK ETF TRUST VANECK GREEN BOND ETF,,,,ETF,UNKNOWN,THINKORSWIM
GSEE,GOLDMAN SACHS ETF TRUST MARKETBETA EMERGING MARKETS,,,,ETF,UNKNOWN,THINKORSWIM
GSEU,GOLDMAN SACHS ETF TRUST ACTIVEBETA EUR ETF,,,,ETF,UNKNOWN,THINKORSWIM
GSEW,GOLDMAN SACHS ETF TRUST EQUAL WEIGHT US ETF,,,,ETF,UNKNOWN,THINKORSWIM
GSG,ISHARES S&P GSCI COMMODITY IDX UNIT BEN INT ETF,,,,ETF,UNKNOWN,THINKORSWIM
GSID,GOLDMAN SACHS ETF TRUST MARKETBETA INTERNATIONAL EQ,,,,ETF,UNKNOWN,THINKORSWIM
GSIE,GOLDMAN SACHS ETF TRUST ACTIVEBETA INT ETF,,,,ETF,UNKNOWN,THINKORSWIM
GSIG,GOLDMAN SACHS ETF TRUST ACCESS INVT GRADE CORP 1 TO,Utilities,Gas Utilities,Gas Utilities,ETF,UNKNOWN,THINKORSWIM
GSJY,GOLDMAN SACHS ETF TRUST ACTIVEBETA JAP ETF,,,,ETF,UNKNOWN,THINKORSWIM
GSLC,GOLDMAN SACHS ETF TRUST ACTIVEBETA U S LARGE CAP EQ,,,,ETF,UNKNOWN,THINKORSWIM
GSSC,GOLDMAN SACHS ETF TRUST ACTIVEBETA US ETF,,,,ETF,UNKNOWN,THINKORSWIM
GSST,GOLDMAN SACHS ETF TRUST ACES ULTRA SHR ETF,,,,ETF,UNKNOWN,THINKORSWIM
GSUS,GOLDMAN SACHS ETF TRUST MARKETBETA U.S. EQUITY ETF,,,,ETF,UNKNOWN,THINKORSWIM
GSY,INVESCO ACTIVELY MANAGED EXCHA ULTRA SHRT DUR ETF,,,,ETF,UNKNOWN,THINKORSWIM
GTIP,GOLDMAN SACHS ETF TRUST ACCESS INFLATI ETF,,,,ETF,UNKNOWN,THINKORSWIM
GTO,INVESCO ACTIVELY MANAGED EXCHA TOTAL RETURN ETF,,,,ETF,UNKNOWN,THINKORSWIM
GUNR,FLEXSHARES TRUST MORNSTAR UPSTR ETF,,,,ETF,UNKNOWN,THINKORSWIM
GURU,GLOBAL X FDS GLB X GURU INDEX ETF,,,,ETF,UNKNOWN,THINKORSWIM
GUSH,DIREXION SHARES ETF TRUST DLY S&P OIL&GAS EXP&PRD BUL 2X,,,,ETF,UNKNOWN,THINKORSWIM
GVAL,CAMBRIA ETF TRUST GLOBAL VALUE ETF,,,,ETF,UNKNOWN,THINKORSWIM
GVI,ISHARES TRUST INTRM GOV CR ETF,,,,ETF,UNKNOWN,THINKORSWIM
GVIP,GOLDMAN SACHS ETF TRUST HEDGE IND ETF,,,,ETF,UNKNOWN,THINKORSWIM
GWX,SPDR INDEX SHARES FUNDS S&P INTL SMLCP ETF,,,,ETF,UNKNOWN,THINKORSWIM
GXC,SPDR INDEX SHARES FUNDS S&P CHINA ETF,,,,ETF,UNKNOWN,THINKORSWIM
GXG,GLOBAL X FDS GLBX MSCI COLUM ETF,,,,ETF,UNKNOWN,THINKORSWIM
GXTG,GLOBAL X FDS THMATC GWT ETF,,,,ETF,UNKNOWN,THINKORSWIM
GYLD,ARROW ETF TR ARROW DJ GLB YLD ETF,,,,ETF,UNKNOWN,THINKORSWIM
HACK,ETF MANAGERS TRUST PRIME CYBR SCRTY ETF,,,,ETF,UNKNOWN,THINKORSWIM
HAIL,SPDR S&P KENSHO SMART ETF,,,,ETF,UNKNOWN,THINKORSWIM
HAP,VANECK ETF TRUST VANECK NATURAL RESOURCES ETF,,,,ETF,UNKNOWN,THINKORSWIM
HAUZ,DBX ETF TRUST XTRACK INTL REAL ETF,,,,ETF,UNKNOWN,THINKORSWIM
HAWX,ISHARES TRUST MSCI ACWI EXUS ETF,,,,ETF,UNKNOWN,THINKORSWIM
HCRB,HARTFORD FUNDS EXCHANGE TRADED CORE BD ETF,,,,ETF,UNKNOWN,THINKORSWIM
HDAW,DBX ETF TRUST XTRACK MSCI ALL ETF,,,,ETF,UNKNOWN,THINKORSWIM
HDEF,DBX ETF TRUST XTRACK MSCI EAFE ETF,,,,ETF,UNKNOWN,THINKORSWIM
HDG,PROSHARES TRUST HD REPLICATION ETF,,,,ETF,UNKNOWN,THINKORSWIM
HDGE,ADVISORSHARES TRUST RANGER EQUITY BE ETF,,,,ETF,UNKNOWN,THINKORSWIM
HDLB,UBS AG LONDON ETRACS MNTY PY 2XLEV US *CLBL,,,,ETF,UNKNOWN,THINKORSWIM
HDMV,FIRST TRUST EXCHANGE-TRADED FU HORIZON MNGD ETF,,,,ETF,UNKNOWN,THINKORSWIM
HDV,ISHARES TRUST CORE HIGH DV ETF,,,,ETF,UNKNOWN,THINKORSWIM
HEDJ,WISDOMTREE TRUST EUROPE HEDGED EQ ETF,,,,ETF,UNKNOWN,THINKORSWIM
HEEM,ISHARES INC CUR HD MSCI EM ETF,,,,ETF,UNKNOWN,THINKORSWIM
HEFA,ISHARES TRUST HDG MSCI EAFE ETF,,,,ETF,UNKNOWN,THINKORSWIM
HELX,FRANKLIN TEMPLETON ETF TR GENOMIC ADVANCEMENTS ETF,,,,ETF,UNKNOWN,THINKORSWIM
HERD,PACER FDS TR CASH COWS ETF,,,,ETF,UNKNOWN,THINKORSWIM
HERO,GLOBAL X FDS VDEO GAM ESPRT ETF,Energy,Energy Equipment & Services,Oil & Gas Drilling,ETF,UNKNOWN,THINKORSWIM
HEWG,ISHARES TRUST CUR HED MSCI GER ETF,,,,ETF,UNKNOWN,THINKORSWIM
HEWJ,ISHARES TRUST HDG MSCI JAPAN ETF,,,,ETF,UNKNOWN,THINKORSWIM
HEZU,ISHARES TRUST CUR HD EURZN ETF,,,,ETF,UNKNOWN,THINKORSWIM
HFXI,INDEXIQ ETF TRUST IQ FTSE INT EQTY CUR NEUTRL,,,,ETF,UNKNOWN,THINKORSWIM
HIBL,DIREXION SHARES ETF TRUST DAILY S&P BULL ETF,,,,ETF,UNKNOWN,THINKORSWIM
HIBS,DIREXION SHARES ETF TRUST DIREXION DLY S&P500 HGH P/S,,,,ETF,UNKNOWN,THINKORSWIM
HIPS,GRANITESHARES ETF TRUST HIPS US HIGH INC ETF,,,,ETF,UNKNOWN,THINKORSWIM
HLAL,LISTED FUND TRUST WAHED FTSE ETF,,,,ETF,UNKNOWN,THINKORSWIM
HMOP,HARTFORD FUNDS EXCHANGE TRADED MUN OPORTUNITE ETF,,,,ETF,UNKNOWN,THINKORSWIM
HNDL,STRATEGY SHARES NS 7HANDL IDX ETF,,,,ETF,UNKNOWN,THINKORSWIM
HOMZ,ETF SERIES SOLUTIONS HOYA CAP HOUSI ETF,,,,ETF,UNKNOWN,THINKORSWIM
HSCZ,ISHARES TRUST MSCI EAFE SMCP ETF,,,,ETF,UNKNOWN,THINKORSWIM
HSMV,FIRST TRUST EXCHANGE TRADED FU HORIZON MANAGED VOLATILITY,,,,ETF,UNKNOWN,THINKORSWIM
HSRT,HARTFORD FUNDS EXCHANGE TRADED SHRT DURTN ETF,,,,ETF,UNKNOWN,THINKORSWIM
HTAB,HARTFORD FUNDS EXCHANGE TRADED SCHRDRS TAX BD ETF,,,,ETF,UNKNOWN,THINKORSWIM
HTEC,EXCHANGE TRADED CONCEPTS TRUST ROBO GBL HLTCR ETF,Health Care,Health Care Providers & Services,Health Care Facilities,ETF,UNKNOWN,THINKORSWIM
HTRB,HARTFORD FUNDS EXCHANGE TRADED TOTAL RTRN ETF,,,,ETF,UNKNOWN,THINKORSWIM
HTUS,CAPITOL SERIES TRUST HULL TACTICAL US ETF,,,,ETF,UNKNOWN,THINKORSWIM
HUSV,FIRST TRUST EXCHANGE-TRADED FU HORIZON DMST ETF,,,,ETF,UNKNOWN,THINKORSWIM
HYBB,ISHARES TRUST BB RATED CORPORATE BOND ETF,,,,ETF,UNKNOWN,THINKORSWIM
HYD,VANECK ETF TRUST VANECK HIGH YIELD MUNI ETF,,,,ETF,UNKNOWN,THINKORSWIM
HYDB,ISHARES TRUST EDEG HIG YIELD ETF,,,,ETF,UNKNOWN,THINKORSWIM
HYDW,DBX ETF TRUST XTRACKERS LOW ETF,,,,ETF,UNKNOWN,THINKORSWIM
HYEM,VANECK ETF TRUST VANECK EMERGING MARKETS HIG,,,,ETF,UNKNOWN,THINKORSWIM
HYG,ISHARES TRUST IBOXX HI YD ETF,,,,ETF,UNKNOWN,THINKORSWIM
HYGH,ISHARES US ETF TRUST IT RT HDG HGYL ETF,,,,ETF,UNKNOWN,THINKORSWIM
HYGV,FLEXSHARES TRUST HIG YLD VL ETF,,,,ETF,UNKNOWN,THINKORSWIM
HYHG,PROSHARES TRUST HGH YLD INT RATE ETF,,,,ETF,UNKNOWN,THINKORSWIM
HYLB,DBX ETF TRUST XTRACK USD HIGH ETF,,,,ETF,UNKNOWN,THINKORSWIM
HYLS,FIRST TR EXCHANGE TRADED FD IV FIRST TR TA HIYL ETF,,,,ETF,UNKNOWN,THINKORSWIM
HYMB,SPDR SERIES TRUST SPDR NUVEEN BLMBRG HIGH YLD,,,,ETF,UNKNOWN,THINKORSWIM
HYS,PIMCO ETF TRUST 0-5 HIGH YIELD ETF,,,,ETF,UNKNOWN,THINKORSWIM
HYTR,NORTHERN LIGHTS FUND TRUST III CP HI YLD TRND ETF,,,,ETF,UNKNOWN,THINKORSWIM
HYUP,DBX ETF TRUST XTRACKERS HIGH ETF,,,,ETF,UNKNOWN,THINKORSWIM
HYXF,ISHARES TRUST ESG ADVANCED HIGH YIELD COR,,,,ETF,UNKNOWN,THINKORSWIM
HYXU,ISHARES INC INTL HIGH YIELD ETF,,,,ETF,UNKNOWN,THINKORSWIM
HYZD,WISDOMTREE TRUST HEDGED HI YLD BD ETF,,,,ETF,UNKNOWN,THINKORSWIM
IAGG,ISHARES TRUST CORE INTL AGGR ETF,,,,ETF,UNKNOWN,THINKORSWIM
IAI,ISHARES TRUST US BR DEL SE ETF,,,,ETF,UNKNOWN,THINKORSWIM
IAK,ISHARES TRUST U.S. INSRNCE ETF,,,,ETF,UNKNOWN,THINKORSWIM
IAT,ISHARES TRUST US REGNL BKS ETF,,,,ETF,UNKNOWN,THINKORSWIM
IAU,ISHARES GOLD TRUST ISHARES NEW ETF,,,,ETF,UNKNOWN,THINKORSWIM
IAUF,ISHARES US ETF TRUST GOLD STRATEGY ETF,,,,ETF,UNKNOWN,THINKORSWIM
IBB,iShares Nasdaq Biotechnology Index Fund,,,,ETF,UNKNOWN,THINKORSWIM
IBD,NORTHERN LIGHTS FUND TRUST IV INSPIRE CORPORATE BOND ETF,,,,ETF,UNKNOWN,THINKORSWIM
IBDP,ISHARES TRUST IBONDS DEC 24 TERM CORP ETF,,,,ETF,UNKNOWN,THINKORSWIM
IBDQ,ISHARES TRUST IBONDS DEC 25 TERM CORP ETF,,,,ETF,UNKNOWN,THINKORSWIM
IBDR,ISHARES TRUST IBONDS DEC2026 ETF,,,,ETF,UNKNOWN,THINKORSWIM
IBDS,ISHARES TRUST IBONDS DEC 2027 TRM CP ETF,,,,ETF,UNKNOWN,THINKORSWIM
IBDT,ISHARES TRUST IBDS DEC28 ETF,,,,ETF,UNKNOWN,THINKORSWIM
IBDU,ISHARES TRUST IBONDS DEC 29 ETF,,,,ETF,UNKNOWN,THINKORSWIM
IBDV,ISHARES TRUST IBONDS DEC 2030 TERM CORPOR,,,,ETF,UNKNOWN,THINKORSWIM
IBHD,ISHARES TRUST IBONDS 24 TRM HG ETF,,,,ETF,UNKNOWN,THINKORSWIM
IBHE,ISHARES TRUST IBONDS 25 TRM HG ETF,,,,ETF,UNKNOWN,THINKORSWIM
IBHF,ISHARES TRUST IBONDS 2026 TERM HGH YLD &,,,,ETF,UNKNOWN,THINKORSWIM
IBMM,ISHARES TRUST IBONDS DEC ETF,,,,ETF,UNKNOWN,THINKORSWIM
IBMN,ISHARES TRUST IBONDS DEC 25 ETF,,,,ETF,UNKNOWN,THINKORSWIM
IBMO,ISHARES TRUST IBONDS DEC 26 ETF,,,,ETF,UNKNOWN,THINKORSWIM
IBMP,ISHARES TRUST IBONDS DEC 27 ETF,,,,ETF,UNKNOWN,THINKORSWIM
IBMQ,ISHARES TRUST IBONDS DEC 28 ETF,,,,ETF,UNKNOWN,THINKORSWIM
IBND,SPDR SERIES TRUST SPDR BLMBRG INTL CORP BD ET,,,,ETF,UNKNOWN,THINKORSWIM
IBTE,ISHARES TRUST IBONDS DEC 2024 TERM TREASU,,,,ETF,UNKNOWN,THINKORSWIM
IBTF,ISHARES TRUST IBONDS DEC 2025 TERM TREASU,,,,ETF,UNKNOWN,THINKORSWIM
IBTG,ISHARES TRUST IBONDS DEC 2026 TERM TREASU,,,,ETF,UNKNOWN,THINKORSWIM
IBTH,ISHARES TRUST IBONDS DEC 2027 TERM TREASU,,,,ETF,UNKNOWN,THINKORSWIM
IBTI,ISHARES TRUST IBONDS DEC 2028 TERM TREASU,,,,ETF,UNKNOWN,THINKORSWIM
IBTJ,ISHARES TRUST IBONDS DEC 2029 TREASURY ETF,,,,ETF,UNKNOWN,THINKORSWIM
IBTK,ISHARES TRUST IBONDS DEC 2030 TERM TREAS,,,,ETF,UNKNOWN,THINKORSWIM
IBUY,AMPLIFY ETF TR ONLIN RETL ETF,,,,ETF,UNKNOWN,THINKORSWIM
ICF,ISHARES TRUST COHEN STEER REIT ETF,,,,ETF,UNKNOWN,THINKORSWIM
ICLN,ISHARES TRUST GL CLEAN ENE ETF,,,,ETF,UNKNOWN,THINKORSWIM
ICOW,PACER FDS TR DEVELOPED MRKT ETF,,,,ETF,UNKNOWN,THINKORSWIM
ICSH,ISHARES TRUST BLACKROCK ULTRA SHT TRM BD,,,,ETF,UNKNOWN,THINKORSWIM
ICVT,ISHARES TRUST CONV BD ETF,,,,ETF,UNKNOWN,THINKORSWIM
IDEV,ISHARES TRUST CORE MSCI INTL ETF,,,,ETF,UNKNOWN,THINKORSWIM
IDHQ,INVESCO EXCH TRADED FD TR II S&P INTL QULTY ETF,,,,ETF,UNKNOWN,THINKORSWIM
IDLV,INVESCO EXCH TRADED FD TR II S&P INTL LOW ETF,,,,ETF,UNKNOWN,THINKORSWIM
IDMO,INVESCO EXCH TRADED FD TR II S&P INTL MOMNT ETF,,,,ETF,UNKNOWN,THINKORSWIM
IDNA,ISHARES TRUST GENOMICS IMMUN ETF,,,,ETF,UNKNOWN,THINKORSWIM
IDOG,ALPS ETF TRUST INTL SEC DV DOG ETF,,,,ETF,UNKNOWN,THINKORSWIM
IDRV,ISHARES TRUST SELF DRIVNG EV ETF,,,,ETF,UNKNOWN,THINKORSWIM
IDU,ISHARES TRUST U.S. UTILITS ETF,,,,ETF,UNKNOWN,THINKORSWIM
IDV,ISHARES TRUST INTL SEL DIV ETF,,,,ETF,UNKNOWN,THINKORSWIM
IDX,VANECK ETF TRUST VANECK INDONESIA INDEX ETF,,,,ETF,UNKNOWN,THINKORSWIM
IEDI,ISHARES US ETF TRUST U.S. CONSUMER FOCUSED ETF,,,,ETF,UNKNOWN,THINKORSWIM
IEF,ISHARES TRUST 7-10 YEAR TREASURY BOND ETF,,,,ETF,UNKNOWN,THINKORSWIM
IEFA,ISHARES TRUST CORE MSCI EAFE ETF,,,,ETF,UNKNOWN,THINKORSWIM
IEI,ISHARES TRUST 3 7 YR TREAS BD ETF,,,,ETF,UNKNOWN,THINKORSWIM
IEMG,ISHARES INC CORE MSCI EMKT ETF,,,,ETF,UNKNOWN,THINKORSWIM
IEO,ISHARES TRUST US OIL GS EX ETF,,,,ETF,UNKNOWN,THINKORSWIM
IETC,ISHARES US ETF TRUST ISHARES US TECH INDEP FOCUS,,,,ETF,UNKNOWN,THINKORSWIM
IEUR,ISHARES TRUST CORE MSCI EURO ETF,,,,ETF,UNKNOWN,THINKORSWIM
IEUS,ISHARES TRUST DEVSMCP EXNA ETF,,,,ETF,UNKNOWN,THINKORSWIM
IEV,ISHARES TRUST EUROPE ETF,,,,ETF,UNKNOWN,THINKORSWIM
IEZ,ISHARES TRUST US OIL EQ&SV ETF,,,,ETF,UNKNOWN,THINKORSWIM
IFGL,ISHARES TRUST INTL DEV RE ETF,,,,ETF,UNKNOWN,THINKORSWIM
IFRA,ISHARES TRUST US INFRASTRUC ETF,,,,ETF,UNKNOWN,THINKORSWIM
IFV,FIRST TR EXCHANGE TRADED FD VI DORSEY WRIGHT ETF,,,,ETF,UNKNOWN,THINKORSWIM
IG,PRINCIPAL EXCHANGE-TRADED FDS PRNC INVT GRAD ETF,Financials,Financial Services,Multi-Sector Holdings,ETF,UNKNOWN,THINKORSWIM
IGBH,ISHARES US ETF TRUST INT RT HD LG TRM CORP BD,,,,ETF,UNKNOWN,THINKORSWIM
IGE,ISHARES TRUST NORTH AMERN NAT ETF,,,,ETF,UNKNOWN,THINKORSWIM
IGEB,ISHARES TRUST INVESTMENT GRADE BOND FACTR,,,,ETF,UNKNOWN,THINKORSWIM
IGF,ISHARES TRUST GLB INFRASTR ETF,,,,ETF,UNKNOWN,THINKORSWIM
IGHG,PROSHARES TRUST INVT INT RT HG ETF,,,,ETF,UNKNOWN,THINKORSWIM
IGIB,ISHARES TRUST 5-10 YEAR INVESTMENT GRADE,,,,ETF,UNKNOWN,THINKORSWIM
IGLB,ISHARES TRUST 10+ YR INVST GRD ETF,,,,ETF,UNKNOWN,THINKORSWIM
IGM,ISHARES TRUST EXPANDED TECH SECTOR ETF,,,,ETF,UNKNOWN,THINKORSWIM
IGOV,ISHARES TRUST INTL TREA BD ETF,,,,ETF,UNKNOWN,THINKORSWIM
IGRO,ISHARES TRUST INTL DIV GRWTH ETF,,,,ETF,UNKNOWN,THINKORSWIM
IGSB,ISHARES TRUST 1-5 YEAR INVT GRADE CORP BD,,,,ETF,UNKNOWN,THINKORSWIM
IGV,ISHARES TRUST EXPANDED TECH SOFTWARE,,,,ETF,UNKNOWN,THINKORSWIM
IHAK,ISHARES TRUST CYBERSECURITY ETF,,,,ETF,UNKNOWN,THINKORSWIM
IHDG,WISDOMTREE TRUST ITL HDG QTLY DIV ETF,,,,ETF,UNKNOWN,THINKORSWIM
IHE,ISHARES TRUST U.S. PHARMA ETF,,,,ETF,UNKNOWN,THINKORSWIM
IHF,ISHARES TRUST US HLTHCR PR ETF,,,,ETF,UNKNOWN,THINKORSWIM
IHI,ISHARES TRUST U.S. MED DVC ETF,,,,ETF,UNKNOWN,THINKORSWIM
IHY,VANECK ETF TRUST VANECK INTERNATIONAL HIGH Y,,,,ETF,UNKNOWN,THINKORSWIM
IIGD,INVESCO EXCHANGE-TRADED SELF INVT GRD DEFSV ETF,,,,ETF,UNKNOWN,THINKORSWIM
IJAN,INNOVATOR ETFS TRUST INTRNTL DEVLPD POW BUF ETF JAN,,,,ETF,UNKNOWN,THINKORSWIM
IJH,ISHARES TRUST CORE S&P MCP ETF,,,,ETF,UNKNOWN,THINKORSWIM
IJJ,ISHARES TRUST S&P MC 400VL ETF,,,,ETF,UNKNOWN,THINKORSWIM
IJK,ISHARES TRUST S&P MC 400GR ETF,,,,ETF,UNKNOWN,THINKORSWIM
IJR,ISHARES TRUST CORE S&P SCP ETF,,,,ETF,UNKNOWN,THINKORSWIM
IJS,ISHARES TRUST SP SMCP600VL ETF,,,,ETF,UNKNOWN,THINKORSWIM
IJT,ISHARES TRUST S&P SML 600 GWT ETF,,,,ETF,UNKNOWN,THINKORSWIM
IJUL,INNOVATOR ETFS TRUST INTRNTL DEVLPD POW BUF ETF JUL,,,,ETF,UNKNOWN,THINKORSWIM
ILF,ISHARES TRUST LATN AMER 40 ETF,,,,ETF,UNKNOWN,THINKORSWIM
ILTB,ISHARES TRUST CORE LT USDB ETF,,,,ETF,UNKNOWN,THINKORSWIM
IMOM,EA SERIES TRUST INTL QUAN MOMNTM ETF,,,,ETF,UNKNOWN,THINKORSWIM
IMTB,ISHARES TRUST CR 5 10 YR ETF,,,,ETF,UNKNOWN,THINKORSWIM
IMTM,ISHARES TRUST MSCI INTL MOMENTUM FACTOR,,,,ETF,UNKNOWN,THINKORSWIM
INCO,COLUMBIA ETF TR II INDIA CONSMR ETF,,,,ETF,UNKNOWN,THINKORSWIM
INDA,ISHARES TRUST MSCI INDIA ETF,,,,ETF,UNKNOWN,THINKORSWIM
INDF,EXCHANGE TRADED CONCEPTS TRUST NIFTY INDIA FINANCIALS ETF,,,,ETF,UNKNOWN,THINKORSWIM
INDL,DIREXION SHARES ETF TRUST DIREXION DAILY MSCI INDIA B,,,,ETF,UNKNOWN,THINKORSWIM
INDS,PACER FDS TR INDUSTRIAL REAL ESTATE ETF,,,,ETF,UNKNOWN,THINKORSWIM
INDY,ISHARES TRUST INDIA 50 ETF,,,,ETF,UNKNOWN,THINKORSWIM
INKM,SSGA ACTIVE ETF TR INCOM ALLO ETF,,,,ETF,UNKNOWN,THINKORSWIM
INTF,ISHARES TRUST INTERNATIONAL EQUITY FACTOR,,,,ETF,UNKNOWN,THINKORSWIM
IOO,ISHARES TRUST GLOBAL 100 ETF,,,,ETF,UNKNOWN,THINKORSWIM
IPAC,ISHARES TRUST CORE MSCI PAC ETF,,,,ETF,UNKNOWN,THINKORSWIM
IPAY,ETF MANAGERS TRUST PRIME MOBILE PAY ETF,,,,ETF,UNKNOWN,THINKORSWIM
IPB,INDEXPLUS TRUST 6.0518% PRF 15/5/33 USD2 *CLBL,,,,ETF,UNKNOWN,THINKORSWIM
IPKW,INVESCO EXCH TRADED FD TR II INTL BUYBACK ETF,,,,ETF,UNKNOWN,THINKORSWIM
IPO,RENAISSANCE CAP GREENWICH FUND IPO ETF,,,,ETF,UNKNOWN,THINKORSWIM
IPOS,RENAISSANCE CAP GREENWICH FUND INTNTL IPO ETF,,,,ETF,UNKNOWN,THINKORSWIM
IQDE,FLEXSHARES TRUST INTL QLTDV DEF ETF,,,,ETF,UNKNOWN,THINKORSWIM
IQDF,FLEXSHARES TRUST INTL QLTDV IDX ETF,,,,ETF,UNKNOWN,THINKORSWIM
IQDG,WISDOMTREE TRUST INTL QULTY DIV ETF,,,,ETF,UNKNOWN,THINKORSWIM
IQDY,FLEXSHARES TRUST INT QLTDVDYNAM ETF,,,,ETF,UNKNOWN,THINKORSWIM
IQIN,INDEXIQ ETF TRUST IQ 500 INT ETF,,,,ETF,UNKNOWN,THINKORSWIM
IQLT,ISHARES TRUST MSCI INTL QUALITY FACTOR,,,,ETF,UNKNOWN,THINKORSWIM
IQM,FRANKLIN TEMPLETON ETF TR INTELLIGENT MACHINES ETF,,,,ETF,UNKNOWN,THINKORSWIM
IQSI,INDEXIQ ETF TRUST CANDRIAM INTL EQUITY ETF,,,,ETF,UNKNOWN,THINKORSWIM
IQSU,INDEXIQ ETF TRUST CANDRIAM US LRG CAP EQT ETF,,,,ETF,UNKNOWN,THINKORSWIM
IRBO,ISHARES TRUST ROBOTICS ARTIF ETF,,,,ETF,UNKNOWN,THINKORSWIM
ISCF,ISHARES TRUST INTERNATIONAL SMLL CAP EQU,,,,ETF,UNKNOWN,THINKORSWIM
ISHG,ISHARES TRUST 3YRTB ETF,,,,ETF,UNKNOWN,THINKORSWIM
ISMD,NORTHERN LIGHTS FUND TRUST IV INSPIRE SMALL/MID CAP ETF,,,,ETF,UNKNOWN,THINKORSWIM
ISRA,VANECK ETF TRUST VANECK ISRAEL ETF,,,,ETF,UNKNOWN,THINKORSWIM
ISTB,ISHARES TRUST CORE 1 5 YR USD ETF,,,,ETF,UNKNOWN,THINKORSWIM
ISZE,ISHARES TRUST MSCI INTL SIZE FACTOR ETF,,,,ETF,UNKNOWN,THINKORSWIM
ITA,ISHARES TRUST US AER DEF ETF,,,,ETF,UNKNOWN,THINKORSWIM
ITB,ISHARES TRUST US HOME CONS ETF,,,,ETF,UNKNOWN,THINKORSWIM
ITEQ,ETF MANAGERS TRUST BLUESTAR ISRAEL ETF,,,,ETF,UNKNOWN,THINKORSWIM
ITM,VANECK ETF TRUST INTERMEDIATE MUNI ETF,,,,ETF,UNKNOWN,THINKORSWIM
ITOT,ISHARES TRUST CORE S&P TTL STK ETF,,,,ETF,UNKNOWN,THINKORSWIM
IUS,INVESCO EXCHANGE TRADED SELF I RAFI STRATGIC US ETF,,,,ETF,UNKNOWN,THINKORSWIM
IUSB,ISHARES TRUST CORE TOTAL USD ETF,,,,ETF,UNKNOWN,THINKORSWIM
IUSG,ISHARES TRUST CORE S&P US GWT ETF,,,,ETF,UNKNOWN,THINKORSWIM
IUSV,ISHARES TRUST CORE S&P US VLU ETF,,,,ETF,UNKNOWN,THINKORSWIM
IVAL,EA SERIES TRUST INTL QUAN VALUE ETF,,,,ETF,UNKNOWN,THINKORSWIM
IVE,ISHARES TRUST S&P 500 VAL ETF,,,,ETF,UNKNOWN,THINKORSWIM
IVES,ETF MANAGERS TRUST WEDBUSH ETFMG GLBAL CLOUD,,,,ETF,UNKNOWN,THINKORSWIM
IVLU,ISHARES TRUST MSCI INTL VLU FT ETF,,,,ETF,UNKNOWN,THINKORSWIM
IVOG,VANGUARD MIDCP 400 GRTH ETF,,,,ETF,UNKNOWN,THINKORSWIM
IVOL,KRANESHARES TR QUADRTC INT RT ETF,,,,ETF,UNKNOWN,THINKORSWIM
IVOO,VANGUARD MIDCP 400 IDX ETF,,,,ETF,UNKNOWN,THINKORSWIM
IVOV,VANGUARD MIDCP 400 VAL ETF,,,,ETF,UNKNOWN,THINKORSWIM
IVV,ISHARES TRUST CORE S&P500 ETF,,,,ETF,UNKNOWN,THINKORSWIM
IVW,ISHARES TRUST S&P 500 GRWT ETF,,,,ETF,UNKNOWN,THINKORSWIM
IWB,ISHARES TRUST RUS 1000 ETF,,,,ETF,UNKNOWN,THINKORSWIM
IWC,ISHARES TRUST MICRO-CAP ETF,,,,ETF,UNKNOWN,THINKORSWIM
IWD,ISHARES TRUST RUS 1000 VAL ETF,,,,ETF,UNKNOWN,THINKORSWIM
IWF,ISHARES TRUST RUS 1000 GRW ETF,,,,ETF,UNKNOWN,THINKORSWIM
IWFH,ISHARES TRUST VIRTUAL WORK & LIFE MULTISE,,,,ETF,UNKNOWN,THINKORSWIM
IWL,ISHARES TRUST RUS TOP 200 ETF,,,,ETF,UNKNOWN,THINKORSWIM
IWM,ISHARES TRUST RUSSELL 2000 ETF,,,,ETF,UNKNOWN,THINKORSWIM
IWN,ISHARES TRUST RUS 2000 VAL ETF,,,,ETF,UNKNOWN,THINKORSWIM
IWO,ISHARES TRUST RUS 2000 GRW ETF,,,,ETF,UNKNOWN,THINKORSWIM
IWP,ISHARES TRUST RUS MD CP GR ETF,,,,ETF,UNKNOWN,THINKORSWIM
IWR,ISHARES TRUST RUS MID CAP ETF,,,,ETF,UNKNOWN,THINKORSWIM
IWS,ISHARES TRUST RUS MDCP VAL ETF,,,,ETF,UNKNOWN,THINKORSWIM
IWV,ISHARES TRUST RUSSELL 3000 ETF,,,,ETF,UNKNOWN,THINKORSWIM
IWX,ISHARES TRUST RUS TP200 VL ETF,,,,ETF,UNKNOWN,THINKORSWIM
IWY,ISHARES TRUST RUS TP200 GR ETF,,,,ETF,UNKNOWN,THINKORSWIM
IXC,ISHARES TRUST GLOBAL ENERG ETF,,,,ETF,UNKNOWN,THINKORSWIM
IXG,ISHARES TRUST GLOBAL FINLS ETF,,,,ETF,UNKNOWN,THINKORSWIM
IXJ,ISHARES TRUST GLOB HLTHCRE ETF,,,,ETF,UNKNOWN,THINKORSWIM
IXN,ISHARES TRUST GLOBAL TECH ETF,,,,ETF,UNKNOWN,THINKORSWIM
IXP,ISHARES TRUST GLOBAL COMM SERVICES ETF,,,,ETF,UNKNOWN,THINKORSWIM
IXUS,ISHARES TRUST CORE MSCI TOTAL ETF,,,,ETF,UNKNOWN,THINKORSWIM
IYC,ISHARES TRUST ISHARES US CONSUMER DISCRET,,,,ETF,UNKNOWN,THINKORSWIM
IYE,ISHARES TRUST U.S. ENERGY ETF,,,,ETF,UNKNOWN,THINKORSWIM
IYF,ISHARES TRUST U.S. FINLS ETF,,,,ETF,UNKNOWN,THINKORSWIM
IYG,ISHARES TRUST U.S. FIN SVC ETF,,,,ETF,UNKNOWN,THINKORSWIM
IYH,ISHARES TRUST US HLTHCARE ETF,,,,ETF,UNKNOWN,THINKORSWIM
IYJ,ISHARES TRUST US INDUSTRIALS ETF,,,,ETF,UNKNOWN,THINKORSWIM
IYK,ISHARES TRUST U.S. CONSUMER STAPLES ETF,,,,ETF,UNKNOWN,THINKORSWIM
IYLD,ISHARES TRUST MRNGSTR INC ETF,,,,ETF,UNKNOWN,THINKORSWIM
IYM,ISHARES TRUST U.S. BAS MTL ETF,,,,ETF,UNKNOWN,THINKORSWIM
IYR,ISHARES TRUST U.S. REAL ES ETF,,,,ETF,UNKNOWN,THINKORSWIM
IYT,ISHARES TRUST U.S.TRANSPORTATION ETF,,,,ETF,UNKNOWN,THINKORSWIM
IYW,ISHARES TRUST U.S. TECH ETF,,,,ETF,UNKNOWN,THINKORSWIM
IYY,ISHARES TRUST DOW JONES US ETF,,,,ETF,UNKNOWN,THINKORSWIM
IYZ,ISHARES TRUST US TELECOM ETF,,,,ETF,UNKNOWN,THINKORSWIM
IZRL,ARK ETF TR ISRAEL INOVATE ETF,,,,ETF,UNKNOWN,THINKORSWIM
JAAA,JANUS DETROIT STREET TRUST JANUS HENDERSON AAA CLO ETF,,,,ETF,UNKNOWN,THINKORSWIM
JCPB,JP MORGAN ETF TRUST CORE PLUS BD ETF,,,,ETF,UNKNOWN,THINKORSWIM
JDST,DIREXION SHARES ETF TRUST DIRXON DLY JR GLD MINR IDX,,,,ETF,UNKNOWN,THINKORSWIM
JEPI,JP MORGAN ETF TRUST EQUITY PREMIUM INCOME ETF,,,,ETF,UNKNOWN,THINKORSWIM
JETS,ETF SERIES SOLUTIONS US GLB JETS ETF,,,,ETF,UNKNOWN,THINKORSWIM
JHEM,JOHN HANCOCK EXCHANGE-TRADED F MULTFCTR EMRNG ETF,,,,ETF,UNKNOWN,THINKORSWIM
JHMD,JOHN HANCOCK EXCHANGE-TRADED F MULTI INTL ETF,,,,ETF,UNKNOWN,THINKORSWIM
JHML,JOHN HANCOCK EXCHANGE-TRADED F MLTFCTR LRG CAP ETF,,,,ETF,UNKNOWN,THINKORSWIM
JHMM,JOHN HANCOCK EXCHANGE-TRADED F MULTIFACTOR MI ETF,,,,ETF,UNKNOWN,THINKORSWIM
JHMU,JOHN HANCOCK EXCHANGE-TRADED F DYNAMIC MUNICIPAL BOND ETF,,,,ETF,UNKNOWN,THINKORSWIM
JHSC,JOHN HANCOCK EXCHANGE-TRADED F MULTIFACTR SML ETF,,,,ETF,UNKNOWN,THINKORSWIM
JIG,JP MORGAN ETF TRUST INTERNATIONAL GROWTH ETF,,,,ETF,UNKNOWN,THINKORSWIM
JMBS,JANUS DETROIT STREET TRUST HENDERSON MTG ETF,,,,ETF,UNKNOWN,THINKORSWIM
JMOM,JP MORGAN ETF TRUST US MOMENTUM ETF,,,,ETF,UNKNOWN,THINKORSWIM
JMST,JP MORGAN ETF TRUST ULTRA SHRT MUNICIPAL INC ETF,,,,ETF,UNKNOWN,THINKORSWIM
JMUB,JP MORGAN ETF TRUST MUNICIPAL ETF,,,,ETF,UNKNOWN,THINKORSWIM
JNK,SPDR BLOOMBERG HIGH YIELD BOND ETF,,,,ETF,UNKNOWN,THINKORSWIM
JNUG,DIREXION SHARES ETF TRUST DIRXN DLY JR GLD MIN IDX 2X,,,,ETF,UNKNOWN,THINKORSWIM
JPEM,JP MORGAN ETF TRUST DIV RTN EM EQT ETF,,,,ETF,UNKNOWN,THINKORSWIM
JPIB,JP MORGAN ETF TRUST INTERNATIONAL BOND OPPORTUN,,,,ETF,UNKNOWN,THINKORSWIM
JPIN,JP MORGAN ETF TRUST DIV RTN INT EQ ETF,,,,ETF,UNKNOWN,THINKORSWIM
JPMB,JP MORGAN ETF TRUST USD EMRNG MKT ETF,,,,ETF,UNKNOWN,THINKORSWIM
JPME,JP MORGAN ETF TRUST DIVERSFED RTRN ETF,,,,ETF,UNKNOWN,THINKORSWIM
JPSE,JP MORGAN ETF TRUST DIVERSFD EQT ETF,,,,ETF,UNKNOWN,THINKORSWIM
JPST,JP MORGAN ETF TRUST ULTRA-SHORT INCOME ETF,,,,ETF,UNKNOWN,THINKORSWIM
JPUS,JP MORGAN ETF TRUST JPMORGAN DIVER ETF,,,,ETF,UNKNOWN,THINKORSWIM
JPXN,ISHARES TRUST JPX NIKKEI 400 ETF,,,,ETF,UNKNOWN,THINKORSWIM
JQUA,JP MORGAN ETF TRUST US QUALTY FCTR ETF,,,,ETF,UNKNOWN,THINKORSWIM
JSMD,JANUS DETROIT STREET TRUST HENDERSN SML ETF,,,,ETF,UNKNOWN,THINKORSWIM
JSML,JANUS DETROIT STREET TRUST HENDERSN CAP ETF,,,,ETF,UNKNOWN,THINKORSWIM
JULZ,LISTED FUND TRUST TRUESHARES STRUCTURED OUT J,,,,ETF,UNKNOWN,THINKORSWIM
JUST,GOLDMAN SACHS ETF TRUST JUST US LRG CP ETF,,,,ETF,UNKNOWN,THINKORSWIM
JVAL,JP MORGAN ETF TRUST US VALUE FACTR ETF,,,,ETF,UNKNOWN,THINKORSWIM
JXI,ISHARES TRUST GLOB UTILITS ETF,,,,ETF,UNKNOWN,THINKORSWIM
KALL,KRANESHARES TR MSCI ALL CHINA ETF,,,,ETF,UNKNOWN,THINKORSWIM
KAPR,INNOVATOR ETFS TRUST US SMALL CAP PWR BUFFER ETF,,,,ETF,UNKNOWN,THINKORSWIM
KARS,KRANESHARES TR ELEC VEH FUTUR ETF,,,,ETF,UNKNOWN,THINKORSWIM
KBA,KRANESHARES TR BOSERA MSCI CHINA A 50 CONN,,,,ETF,UNKNOWN,THINKORSWIM
KBE,SPDR SERIES TRUST S&P BK ETF,,,,ETF,UNKNOWN,THINKORSWIM
KBWB,INVESCO EXCH TRADED FD TR II KBW BK ETF,,,,ETF,UNKNOWN,THINKORSWIM
KBWD,INVESCO EXCH TRADED FD TR II KBW HIG DV YLD ETF,,,,ETF,UNKNOWN,THINKORSWIM
KBWP,INVESCO EXCH TRADED FD TR II KBW PPTY CASUT ETF,,,,ETF,UNKNOWN,THINKORSWIM
KBWR,INVESCO EXCH TRADED FD TR II KBW REGL BKG ETF,,,,ETF,UNKNOWN,THINKORSWIM
KBWY,INVESCO EXCH TRADED FD TR II KBW PREM YIELD ETF,,,,ETF,UNKNOWN,THINKORSWIM
KCE,SPDR SERIES TRUST S&P CAP MKTS ETF,,,,ETF,UNKNOWN,THINKORSWIM
KEMQ,KRANESHARES TR EMRNG MKT CONS ETF,,,,ETF,UNKNOWN,THINKORSWIM
KEMX,KRANESHARES TR MSCI EMG EX CH ETF,,,,ETF,UNKNOWN,THINKORSWIM
KGRN,KRANESHARES TR MSCI CHINA CLEAN TECH IND ETF,,,,ETF,UNKNOWN,THINKORSWIM
KIE,SPDR SERIES TRUST S&P INS ETF,,,,ETF,UNKNOWN,THINKORSWIM
KJAN,INNOVATOR ETFS TRUST INNOVATOR US SML CAP POWER,,,,ETF,UNKNOWN,THINKORSWIM
KJUL,INNOVATOR ETFS TRUST INNOVATOR US SML CAP POWER,,,,ETF,UNKNOWN,THINKORSWIM
KLDW,INVESTMENT MANAGERS SER TR KNOWLEDGE LEADERS DEVELOPED,,,,ETF,UNKNOWN,THINKORSWIM
KNG,FIRST TR EXCHANGE TRADED FD IV VEST S&P 500 DIV ARISTO TRG,,,,ETF,UNKNOWN,THINKORSWIM
KOCT,INNOVATOR ETFS TRUST INNOVATOR US SML CAP PWR BU,,,,ETF,UNKNOWN,THINKORSWIM
KOIN,EXCHANGE TRADED CONCEPTS TRUST CAPITAL LINK GLBL FINTECH LDRS,,,,ETF,UNKNOWN,THINKORSWIM
KOKU,DBX ETF TRUST XTRACKERS MSCI KOKUSAI EQTY,,,,ETF,UNKNOWN,THINKORSWIM
KOLD,PROSHARES TRUST II ULTRASHORT BLOOMBERG NATURA,,,,ETF,UNKNOWN,THINKORSWIM
KOMP,SPDR S&P KENSHO NEW ECON COMP ETF,,,,ETF,UNKNOWN,THINKORSWIM
KORP,AMERICAN CENTURY INVESTMENTS DIVERSIFID CRP ETF,,,,ETF,UNKNOWN,THINKORSWIM
KORU,DIREXION SHARES ETF TRUST DRX DLYSOKOR3X ETF,,,,ETF,UNKNOWN,THINKORSWIM
KRBN,KRANESHARES TR GLOBAL CARBON STRATEGY ETF,,,,ETF,UNKNOWN,THINKORSWIM
KRE,SPDR SERIES TRUST S&P REGL BKG ETF,,,,ETF,UNKNOWN,THINKORSWIM
KRMA,GLOBAL X FDS CONSCIOUS COS ETF,,,,ETF,UNKNOWN,THINKORSWIM
KSA,ISHARES TRUST MSCI SAUDI ARBIA ETF,,,,ETF,UNKNOWN,THINKORSWIM
KURE,KRANESHARES TR MSCI ALL CHINA ETF,,,,ETF,UNKNOWN,THINKORSWIM
KWEB,KRANESHARES TR CSI CHI INTERNET ETF,,,,ETF,UNKNOWN,THINKORSWIM
KWT,ISHARES TRUST MSCI KUWAIT ETF,,,,ETF,UNKNOWN,THINKORSWIM
KXI,ISHARES TRUST GLB CNSM STP ETF,,,,ETF,UNKNOWN,THINKORSWIM
LABD,DIREXION SHARES ETF TRUST DAILY S&P BIOTEC ETF,,,,ETF,UNKNOWN,THINKORSWIM
LABU,DIREXION SHARES ETF TRUST DAILY S&P BIOTECH BULL R/S,,,,ETF,UNKNOWN,THINKORSWIM
LCG,NORTHERN LIGHTS FUND TRUST IV STERLING CAPITAL FOCUS EQUI,,,,ETF,UNKNOWN,THINKORSWIM
LCR,LEUTHOLD FUNDS INC CORE ETF,,,,ETF,UNKNOWN,THINKORSWIM
LDEM,ISHARES TRUST ESG MSCI EM LDRS ETF,,,,ETF,UNKNOWN,THINKORSWIM
LDSF,FIRST TR EXCH TRADED FD VIII LOW DUR STRTGC ETF,,,,ETF,UNKNOWN,THINKORSWIM
LDUR,PIMCO ETF TRUST ENHNCD LW DUR AC ETF,,,,ETF,UNKNOWN,THINKORSWIM
LEAD,SIREN ETF TR DIVCN LDRS ETF,,,,ETF,UNKNOWN,THINKORSWIM
LEGR,FIRST TR EXCHANGE TRADED FD VI INDXX INOVTV ETF,,,,ETF,UNKNOWN,THINKORSWIM
